{
  "schema_version" : "1.0.0",
  "run_id" : "RUN-01M293KJ0RYV603B3JB0CCJJN9",
  "edge_id" : "EDGE-1-PREP-TEST",
  "generated_at" : "2026-09-11T21:21:55.459094700Z",
  "purpose" : "Everything this migration edge did, resolved from the run timeline so every attempt is included rather than only the one the stage pointer names.",
  "plan" : {
    "edge_class" : "PREPARATORY",
    "source_state" : "2.7.12",
    "target_state" : "2.7.12",
    "java_version" : "17.0.20.1",
    "spring_cloud_version" : "2021.0.9",
    "validation_depth" : "FULL_DIFFERENTIAL",
    "risk" : "HIGH",
    "rationale" : "Migrate test infrastructure before framework changes so pass/fail/skip semantics are proven to survive independently.",
    "deterministic_coverage" : 0.9697,
    "expected_residual" : 0.030299999999999994,
    "mandatory_checkpoint" : true,
    "approval_required" : true,
    "recipes" : [ {
      "recipe_id" : "test.junit4-to-jupiter",
      "preferred_transformer" : "BOOTSHIFT_TEST_FRAMEWORK",
      "fallback_strategy" : "Report residual and let the bounded compile-repair loop handle what remains",
      "capability_id" : "CAP-JUNIT4-JUPITER",
      "capability_provider" : "BOOTSHIFT_TEST_FRAMEWORK",
      "capability_status" : "AVAILABLE",
      "capability_license" : "MIT",
      "deterministic" : true,
      "parameters" : { },
      "why" : "Test infrastructure moves before any framework change so pass/fail/skip semantics are proven to survive on their own"
    } ],
    "recipes_without_capability" : [ ],
    "facts" : [ "MK-00009", "MK-00010", "MK-00011", "MK-00012", "MK-00013", "MK-00014", "MK-00015", "MK-00016", "MK-00017", "MK-00018", "MK-00019", "MK-00020", "MK-00021", "MK-00022", "MK-00023", "MK-00024", "MK-00025", "MK-00026", "MK-00027", "MK-00028", "MK-00029", "MK-00030", "MK-00031", "MK-00032", "MK-00033", "MK-00034", "MK-00035", "MK-00036", "MK-00037", "MK-00038", "MK-00039", "MK-00040", "MK-00041", "MK-00042", "MK-00043", "MK-00044", "MK-00045", "MK-00046", "MK-00047", "MK-00048", "MK-00049", "MK-00050", "MK-00051", "MK-00052", "MK-00053", "MK-00054", "MK-00055", "MK-00056", "MK-00057", "MK-00058", "MK-00059", "MK-00060", "MK-00061", "MK-00062", "MK-00063", "MK-00064", "MK-00065", "MK-00066", "MK-00067", "MK-00068", "MK-00069", "MK-00070", "MK-00071", "MK-00072", "MK-00073", "MK-00074", "MK-00075", "MK-00076", "MK-00077", "MK-00078", "MK-00079", "MK-00080", "MK-00081", "MK-00082", "MK-00083", "MK-00084", "MK-00085", "MK-00086", "MK-00087", "MK-00088", "MK-00089", "MK-00090", "MK-00091", "MK-00092", "MK-00093", "MK-00094", "MK-00095", "MK-00096", "MK-00097", "MK-00098", "MK-00099", "MK-00100", "MK-00101", "MK-00102", "MK-00103", "MK-00104", "MK-00105", "MK-00106", "MK-00107", "MK-00108", "MK-00109", "MK-00110", "MK-00111", "MK-00112", "MK-00113", "MK-00114", "MK-00115", "MK-00116", "MK-00117", "MK-00353", "MK-00354", "MK-00355", "MK-00356", "MK-00357", "MK-00358", "MK-00359", "MK-00360", "MK-00361", "MK-00362", "MK-00363", "MK-00364", "MK-00365", "MK-00366", "MK-00367", "MK-00368", "MK-00469", "MK-00470", "MK-00998", "MK-01000", "MK-01001", "MK-01004", "MK-01005", "MK-01006", "MK-01007", "MK-01008", "MK-01009", "MK-01010", "MK-01011", "MK-01012", "MK-01013", "MK-01014", "MK-01015", "MK-01017", "MK-01018", "MK-01019", "MK-01020", "MK-01021", "MK-01145", "MK-01146", "MK-01147", "MK-01148", "MK-01149", "MK-01150", "MK-01151", "MK-01152", "MK-01153", "MK-01154", "MK-01155", "MK-01156", "MK-01157", "MK-01158", "MK-01159", "MK-01160", "MK-01161", "MK-01162", "MK-01163", "MK-01164", "MK-01165", "MK-01166", "MK-01167", "MK-01168", "MK-01169", "MK-01170", "MK-01171", "MK-01172", "MK-01173", "MK-01174", "MK-01175", "MK-01176", "MK-01177", "MK-01178", "MK-01179", "MK-01180", "MK-01181", "MK-01182", "MK-01183", "MK-01184", "MK-01185", "MK-01186", "MK-01187", "MK-01188", "MK-01189", "MK-01190", "MK-01191", "MK-01192", "MK-01193", "MK-01194", "MK-01195", "MK-01196", "MK-01197", "MK-01198", "MK-01199", "MK-01200", "MK-01201", "MK-01202", "MK-01203", "MK-01204", "MK-01205", "MK-01206", "MK-01207", "MK-01208", "MK-01209", "MK-01210", "MK-01211", "MK-01212", "MK-01213", "MK-01214", "MK-01215", "MK-01216", "MK-01217", "MK-01218", "MK-01219", "MK-01220", "MK-01221", "MK-01222", "MK-01223", "MK-01224", "MK-01225", "MK-01226", "MK-01227", "MK-01228", "MK-01229", "MK-01230", "MK-01231", "MK-01232", "MK-01233", "MK-01234", "MK-01235", "MK-01236", "MK-01237", "MK-01238", "MK-01239", "MK-01240", "MK-01241", "MK-01242", "MK-01243", "MK-01244", "MK-01245", "MK-01246", "MK-01247", "MK-01248", "MK-01249", "MK-01250", "MK-01251", "MK-01252", "MK-01253", "MK-01254", "MK-01255", "MK-01256", "MK-01257", "MK-01258", "MK-01259", "MK-01260", "MK-01261", "MK-01262", "MK-01263", "MK-01264", "MK-01265", "MK-01266", "MK-01267", "MK-01268", "MK-01269", "MK-01270", "MK-01271", "MK-01272", "MK-01273", "MK-01274", "MK-01275", "MK-01276", "MK-01277", "MK-01278", "MK-01279", "MK-01280", "MK-01281", "MK-01282", "MK-01283", "MK-01284", "MK-01285", "MK-01286", "MK-01287", "MK-01288", "MK-01289", "MK-01290", "MK-01291", "MK-01292", "MK-01293", "MK-01294", "MK-01295", "MK-01296", "MK-01297", "MK-01298", "MK-01299", "MK-01300", "MK-01301", "MK-01302", "MK-01303", "MK-01304", "MK-01305", "MK-01306", "MK-01307", "MK-01308", "MK-01309", "MK-01310", "MK-01311", "MK-01312", "MK-01313", "MK-01314", "MK-01315", "MK-01316", "MK-01317", "MK-01318", "MK-01319", "MK-01320", "MK-01321", "MK-01322", "MK-01323", "MK-01324", "MK-01325", "MK-01326", "MK-01327", "MK-01328", "MK-01329", "MK-01330", "MK-01331", "MK-01332", "MK-01333", "MK-01334", "MK-01335", "MK-01336", "MK-01337", "MK-01338", "MK-01339", "MK-01340", "MK-01341", "MK-01342", "MK-01343", "MK-01344", "MK-01345", "MK-01346", "MK-01347", "MK-01348", "MK-01349", "MK-01350", "MK-01351", "MK-01352", "MK-01353", "MK-01354", "MK-01355", "MK-01356", "MK-01357", "MK-01358", "MK-01359", "MK-01360", "MK-01361", "MK-01362", "MK-01363", "MK-01364", "MK-01365", "MK-01366", "MK-01367", "MK-01368", "MK-01369", "MK-01370", "MK-01371", "MK-01372", "MK-01373", "MK-01374", "MK-01375", "MK-01376", "MK-01377", "MK-01378", "MK-01379", "MK-01380", "MK-01381", "MK-01382", "MK-01383", "MK-01384", "MK-01385", "MK-01386", "MK-01387", "MK-01388", "MK-01389", "MK-01390", "MK-01391", "MK-01392", "MK-01393", "MK-01394", "MK-01395", "MK-01396", "MK-01397", "MK-01398", "MK-01399", "MK-01400", "MK-01401", "MK-01402", "MK-01403", "MK-01404", "MK-01405", "MK-01406", "MK-01407", "MK-01408", "MK-01409", "MK-01410", "MK-01411", "MK-01412", "MK-01413", "MK-01414", "MK-01415", "MK-01416", "MK-01417", "MK-01418", "MK-01419", "MK-01420", "MK-01421", "MK-01422", "MK-01423", "MK-01424", "MK-01425", "MK-01426", "MK-01427", "MK-01428", "MK-01429", "MK-01430", "MK-01431", "MK-01432", "MK-01433", "MK-01434", "MK-01435", "MK-01436", "MK-01437", "MK-01438", "MK-01439", "MK-01440", "MK-01441", "MK-01442", "MK-01443", "MK-01444", "MK-01445", "MK-01446", "MK-01447", "MK-01448", "MK-01449", "MK-01450", "MK-01451", "MK-01452", "MK-01453", "MK-01454", "MK-01455", "MK-01456", "MK-01457", "MK-01458", "MK-01459", "MK-01460", "MK-01461", "MK-01462", "MK-01463", "MK-01464", "MK-01465", "MK-01466", "MK-01467", "MK-01468", "MK-01469", "MK-01470", "MK-01471", "MK-01472", "MK-01473", "MK-01474", "MK-01475", "MK-01476", "MK-01477", "MK-01478", "MK-01479", "MK-01480", "MK-01481", "MK-01482", "MK-01483", "MK-01484", "MK-01485", "MK-01486", "MK-01487", "MK-01488", "MK-01489", "MK-01490", "MK-01491", "MK-01492", "MK-01493", "MK-01494", "MK-01495", "MK-01496", "MK-01497", "MK-01498", "MK-01499", "MK-01500", "MK-01501", "MK-01502", "MK-01503", "MK-01504", "MK-01505", "MK-01506", "MK-01507", "MK-01508", "MK-01509", "MK-01510", "MK-01511", "MK-01512", "MK-01513", "MK-01514", "MK-01515", "MK-01516", "MK-01517", "MK-01518", "MK-01519", "MK-01520", "MK-01521", "MK-01522", "MK-01523", "MK-01524", "MK-01525", "MK-01526", "MK-01527", "MK-01528", "MK-01529", "MK-01530", "MK-01531", "MK-01532", "MK-01533", "MK-01534", "MK-01535", "MK-01536", "MK-01537", "MK-01538", "MK-01539", "MK-01540", "MK-01541", "MK-01542", "MK-01543", "MK-01544", "MK-01545", "MK-01546", "MK-01547", "MK-01548", "MK-01549", "MK-01550", "MK-01551", "MK-01552", "MK-01553", "MK-01554", "MK-01555", "MK-01556", "MK-01557", "MK-01558", "MK-01559", "MK-01560", "MK-01561", "MK-01562", "MK-01563", "MK-01564", "MK-01565", "MK-01566", "MK-01567", "MK-01568", "MK-01569", "MK-01570", "MK-01571", "MK-01572", "MK-01573", "MK-01574", "MK-01575", "MK-01576", "MK-01577", "MK-01578", "MK-01579", "MK-01580", "MK-01581", "MK-01582", "MK-01583", "MK-01584", "MK-01585", "MK-01586", "MK-01587", "MK-01588", "MK-01589", "MK-01590", "MK-01591", "MK-01592", "MK-01593", "MK-01594", "MK-01595", "MK-01596", "MK-01597", "MK-01598", "MK-01599", "MK-01600", "MK-01601", "MK-01602", "MK-01603", "MK-01604", "MK-01605", "MK-01606", "MK-01607", "MK-01608", "MK-01609", "MK-01610", "MK-01611", "MK-01612", "MK-01613", "MK-01614", "MK-01615", "MK-01616", "MK-01617", "MK-01618", "MK-01619", "MK-01620", "MK-01621", "MK-01622", "MK-01623", "MK-01624", "MK-01625", "MK-01626", "MK-01627", "MK-01628", "MK-01629", "MK-01630", "MK-01631", "MK-01632", "MK-01633", "MK-01634", "MK-01635", "MK-01636", "MK-01637", "MK-01638", "MK-01639", "MK-01640", "MK-01641", "MK-01642", "MK-01643", "MK-01644", "MK-01645", "MK-01646", "MK-01647", "MK-01648", "MK-01649", "MK-01650", "MK-01651", "MK-01652", "MK-01653", "MK-01654", "MK-01655", "MK-01656", "MK-01657", "MK-01658", "MK-01659", "MK-01660", "MK-01661", "MK-01662", "MK-01663", "MK-01664", "MK-01665", "MK-01666", "MK-01667", "MK-01668", "MK-01669", "MK-01670", "MK-01671", "MK-01672", "MK-01673", "MK-01674", "MK-01675", "MK-01676", "MK-01677", "MK-01678", "MK-01679", "MK-01680", "MK-01681", "MK-01682", "MK-01683", "MK-01684", "MK-01685", "MK-01686", "MK-01689", "MK-01690", "MK-01691" ],